Filename,File Path,Description,Shot Details,Notes,Resolution,Priority,Suggested Open Source Content
hero-screenshot.png,./assets/images/hero-screenshot.png,Main hero image showcasing the overall CineSync interface,"Full dashboard view showing multiple watchlists, Clean organized layout with movie/TV show posters, Show main navigation and key features prominently, Aspect ratio 16:9 or similar wide format","Create actual lists with open source content to make it look realistic. Download posters/metadata for the suggested content and import into your app for authentic screenshots.","1600x900px minimum",High,"Big Buck Bunny, Sintel, Elephants Dream, Tears of Steel, Cosmos Laundromat"
screenshot-dashboard.png,./assets/images/screenshot-dashboard.png,Personal dashboard view showing watchlist organization,"Display multiple custom lists with different themes/categories, Show visual progress tracking (watched vs. unwatched items), Include stats or summary information, Demonstrate the clean card-based layout","Focus on the organizational aspect - show how users can categorize their content. Use generic titles like ""Adventure Film 1"", ""Comedy Series"", ""Documentary 2023"", etc. Emphasize the visual hierarchy and ease of navigation.",1200x800px minimum,High
screenshot-create-list.png,./assets/images/screenshot-create-list.png,Custom list creation interface,"Show the list creation modal/form, Display custom icon and color selection options, Include example list names like ""Weekend Favorites"" ""To Watch Soon"" ""Family Movies"", Show theme customization options","This screenshot should highlight the customization capabilities. Show various icon options and color themes. Make it clear that users can personalize their experience extensively.",1200x800px minimum,Medium
screenshot-search.png,./assets/images/screenshot-search.png,Search and content discovery interface,"Show search results with movie/TV show cards, Include filters (genre year rating etc.), Display search bar with example query like ""action movies 2023"", Show ""Add to List"" buttons or similar import functionality","Demonstrate the search and discovery capabilities. Use generic search results that show the filtering and metadata capabilities without using real copyrighted titles. Focus on the rich metadata display and easy-to-use interface.",1200x800px minimum,High
screenshot-mobile.png,./assets/images/screenshot-mobile.png,Native iOS app interface,"Show mobile app interface in iPhone frame, Display touch-optimized navigation, Show how lists appear on mobile, Include mobile-specific features (swipe gestures etc.)","This should demonstrate cross-platform compatibility. Show the responsive design and mobile-first features. Ensure the interface looks native to iOS while maintaining brand consistency.",400x800px (mobile),Medium
screenshot-admin.png,./assets/images/screenshot-admin.png,Admin dashboard for multi-user setups,"Show user management interface, Display system settings and configuration options, Include analytics or usage statistics, Show server status or Jellyfin integration settings","This targets power users and self-hosters. Focus on showing advanced management capabilities, system health monitoring, and multi-user features. Keep any data shown generic (use example usernames like ""User1"" ""Admin"" etc.).",1200x800px minimum,Low
screenshot-collections.png,./assets/images/screenshot-collections.png,Smart collections view showing franchises and series,"Display movie franchises grouped together (use generic titles like ""Action Series Collection""), Show TV series with season/episode tracking, Include progress indicators for multi-part content, Demonstrate automatic grouping features","Highlight the smart organization features. Show how the app automatically groups related content. Use fictional franchise names like ""Adventure Chronicles"" ""Mystery Series"" ""Comedy Collection"" to avoid copyright issues.",1200x800px minimum,Medium
